{
  "schemaVersion": "design-validation/attestation/v2",
  "targetId": "yyeongjin-secret-mcp-use--gdweb-26357",
  "sectionId": "S09",
  "fingerprint": "sha256:d135049fb6e3b4133649caf83dc7d562f0d100f8984bdea670ece5c570b58d5e",
  "triggerSource": {
    "path": "trigger/DESIGN_INDEX_gdweb-26357.md",
    "documentHash": "sha256:f79f163969cbb3520f2741dde3250533a4ff3071dcb772e53dd5802b918e6336",
    "fragmentHash": "sha256:343fdbeecbbc8ca25485e920373908e65c8ff727f9bb6734b95f13049bd0100b"
  },
  "specificationSource": {
    "path": "DESIGN_INDEX_SPECIFICATION.md",
    "documentHash": "sha256:65233a5428ae3411c094ab72691793e2998232e55ea5ca4e299993f7c4cf251a",
    "globalRulesHash": "sha256:397b59d360af5b81cb8816ecdf12ad45bbd3c55990df199c67adf9b399fb2987",
    "fragmentHash": "sha256:e5f90b342443f736b9942a7f41d1b6f0f4b40eae832e92e1bebd3c7bca6f2cac"
  },
  "status": "PASS",
  "baseCommit": "a73e70936bd3199364977414e01e557197620e17",
  "source": "fresh-audit",
  "requirementIds": [
    "S09-REQ-E0888960D549",
    "S09-REQ-59BEE02BECA0",
    "S09-REQ-CBC818B44317",
    "S09-REQ-8F1E96C96061",
    "S09-REQ-8F19027F5B29",
    "S09-REQ-6E1481936109",
    "S09-REQ-775BB10E7DD4",
    "S09-REQ-96C50E4B3B41",
    "S09-REQ-8814BB952B09",
    "S09-REQ-4F124FC03B55",
    "S09-REQ-050E6703277E",
    "S09-REQ-07BF36D47D7A",
    "S09-REQ-4D62DA815E56",
    "S09-REQ-9D9261E37D1D",
    "S09-REQ-8C9FDD83D867",
    "S09-REQ-9E2495D798E1",
    "S09-REQ-4505135F5BFA",
    "S09-REQ-3F523179568F",
    "S09-REQ-539D5FBFB22C",
    "S09-REQ-C543B5E12617",
    "S09-REQ-A9DE540417CD",
    "S09-REQ-A9EF69B211A6",
    "S09-REQ-06458DCE3748",
    "S09-REQ-630EDFEB698A",
    "S09-REQ-537A5158AD8D",
    "S09-REQ-A88041450184",
    "S09-REQ-F791F0FC2945",
    "S09-REQ-48C6AD87D229",
    "S09-REQ-613DFBFF9836",
    "S09-REQ-08E45B05B307",
    "S09-REQ-3E69CEDDEC19",
    "S09-REQ-4B442497B7BF",
    "S09-REQ-2D82A21A1C36",
    "S09-REQ-3A1B8E155391",
    "S09-REQ-E8B17C579517",
    "S09-REQ-FB9A9EA02E72",
    "S09-REQ-CE5101B4B663",
    "S09-REQ-5CA89A198E9D",
    "S09-REQ-7545CAB84CFF",
    "S09-REQ-0A0C45CBD04A",
    "S09-REQ-7E7A8BE6E440",
    "S09-REQ-A7BFEC952F1B",
    "S09-REQ-AA794550C501",
    "S09-REQ-782119774360",
    "S09-REQ-6A7EE531EAE7",
    "S09-REQ-A24925D6FF67",
    "S09-REQ-2766676BCD64",
    "S09-REQ-253EFFF84AD9",
    "S09-REQ-A6622EF9114F",
    "S09-REQ-51FAD0B34333",
    "S09-REQ-F6FEEED68B9C",
    "S09-REQ-547EB7AA7FEF",
    "S09-REQ-BDFA9B4D17B9",
    "S09-REQ-D6E0212467B0",
    "S09-REQ-583EFC0A53A6",
    "S09-REQ-4B3F4328B379",
    "S09-REQ-7FE36C788649",
    "S09-REQ-FFA3E30E1A98",
    "S09-REQ-E59D1692060A",
    "S09-REQ-5D7AC557E60D",
    "S09-REQ-432E23A225A9",
    "S09-REQ-0190A5B78EDB",
    "S09-REQ-09927098EA84",
    "S09-REQ-A3110DD7D775",
    "S09-REQ-860C48689D20",
    "S09-REQ-B4FC13B5A29D",
    "S09-REQ-1EFDC8A4A8F2",
    "S09-REQ-4C444E0DD843",
    "S09-REQ-B44AD242738B",
    "S09-REQ-9DB22ED583A9",
    "S09-REQ-1EB67319358B",
    "S09-REQ-8B67772A5F90",
    "S09-REQ-5C8FCA87AA59",
    "S09-REQ-FDF6669AD49F",
    "S09-REQ-1492698A058F",
    "S09-REQ-8B918A29B031",
    "S09-REQ-0367235E343E",
    "S09-REQ-9C8AAA3C858D",
    "S09-REQ-F72DF7884B25",
    "S09-REQ-FCC8203516A2",
    "S09-REQ-BC27E5BB98E3",
    "S09-REQ-5FE5F07CC33B",
    "S09-REQ-D10B36AA74A5",
    "S09-REQ-73104CE12ACB",
    "S09-REQ-1B64579003E0",
    "S09-REQ-DFC921C82695",
    "S09-REQ-5A8338F9610F"
  ],
  "dependencyAttestations": {
    "S02": "sha256:ab31acd3a4100496f301d9e2d1ec76bc08b27b07545ac99d9b612ed2c0a3e830"
  },
  "dependencyPublicDigests": {
    "S02": "sha256:44136fa355b3678a1146ad16f7e8649e94fb4fc21fe77e8310c060f61caaff8a"
  },
  "publicOutput": {},
  "publicDigest": "sha256:44136fa355b3678a1146ad16f7e8649e94fb4fc21fe77e8310c060f61caaff8a",
  "validator": {
    "id": "nvidia:nvidia/nemotron-3-super-120b-a12b",
    "contractHash": "sha256:65021547d83414ad8b7ae31c93dbb68e23cd67a5cade8647ac7b84f05433af9b"
  },
  "tests": [
    {
      "id": "audit-schema",
      "status": "PASS",
      "artifactHash": "sha256:f0f7b16820c8ac7b5a2de245cef86ae8057941d87ce7596e4f80e5067c56dbd1"
    }
  ],
  "createdAt": "2026-08-21T17:26:20.648Z",
  "attestationHash": "sha256:067318a7a147e4c300016bfbc793b4d325bf47eeb0f8870770fabade6141e050"
}
