{
  "schemaVersion": "design-validation/attestation/v2",
  "targetId": "yyeongjin-secret-mcp-use--gdweb-26357",
  "sectionId": "S03",
  "fingerprint": "sha256:7f453fd64378b2dcd917e48c51190280634e012db22e44082e07533e434ad17d",
  "triggerSource": {
    "path": "trigger/DESIGN_INDEX_gdweb-26357.md",
    "documentHash": "sha256:f79f163969cbb3520f2741dde3250533a4ff3071dcb772e53dd5802b918e6336",
    "fragmentHash": "sha256:4b6b1df256ecdb68282ddea2e640dd25f8ab9421e069f6e81d905c01a4e7c63f"
  },
  "specificationSource": {
    "path": "DESIGN_INDEX_SPECIFICATION.md",
    "documentHash": "sha256:65233a5428ae3411c094ab72691793e2998232e55ea5ca4e299993f7c4cf251a",
    "globalRulesHash": "sha256:397b59d360af5b81cb8816ecdf12ad45bbd3c55990df199c67adf9b399fb2987",
    "fragmentHash": "sha256:ab2d64cca87cedde7b0b4ec3f37dcb7c551533c8eed77e7620dc8915f47a8867"
  },
  "status": "PASS",
  "baseCommit": "8b312bac8411f01b3bfb04924d2ff25f2730618c",
  "source": "fresh-audit",
  "requirementIds": [
    "S03-REQ-8E97A3537456",
    "S03-REQ-92A16BF546FB",
    "S03-REQ-83C46F4E1D08",
    "S03-REQ-51EC990297A6",
    "S03-REQ-99A97C6CB73E",
    "S03-REQ-EBA62230BE86",
    "S03-REQ-17A802FF800E"
  ],
  "dependencyAttestations": {
    "S01": "sha256:6a1b8ba50c07d616786a274181ab8f2b3407caf5041576c63b8051d64952938c",
    "S02": "sha256:0a3a5dd12803c32121e7def892eb63d9aa7bb05edb0104d78f99325f74234903"
  },
  "dependencyPublicDigests": {
    "S01": "sha256:44136fa355b3678a1146ad16f7e8649e94fb4fc21fe77e8310c060f61caaff8a",
    "S02": "sha256:44136fa355b3678a1146ad16f7e8649e94fb4fc21fe77e8310c060f61caaff8a"
  },
  "publicOutput": {},
  "publicDigest": "sha256:44136fa355b3678a1146ad16f7e8649e94fb4fc21fe77e8310c060f61caaff8a",
  "validator": {
    "id": "nvidia:nvidia/nemotron-3-super-120b-a12b",
    "contractHash": "sha256:3dadde392d53ca2fc5bc7abcb16154fc8c7fd187e43d390c2bc6cb185af4d4a3"
  },
  "tests": [
    {
      "id": "audit-schema",
      "status": "PASS",
      "artifactHash": "sha256:49c3e1296459dd6264c24fbef4a568dfe9c0ecdc3dfef5f0898034759cdd941f"
    }
  ],
  "createdAt": "2026-08-22T16:10:16.236Z",
  "attestationHash": "sha256:6ed9a3b8a031e9c933a215154ea59a1167df6778e32bfd5be6b1d791a806e088"
}
