{
  "schemaVersion": "design-validation/attestation/v2",
  "targetId": "yyeongjin-secret-mcp-use--gdweb-26357",
  "sectionId": "S10",
  "fingerprint": "sha256:94cb1cf99c8acc28f78e05f3a07eb82fd8f6272c17fc1cb6d4b967be7102811f",
  "triggerSource": {
    "path": "trigger/DESIGN_INDEX_gdweb-26357.md",
    "documentHash": "sha256:f79f163969cbb3520f2741dde3250533a4ff3071dcb772e53dd5802b918e6336",
    "fragmentHash": "sha256:7d39bc148bb58db9a3037af939f691fd484685dd7bfaf1e8d9950f01eb2923c1"
  },
  "specificationSource": {
    "path": "DESIGN_INDEX_SPECIFICATION.md",
    "documentHash": "sha256:65233a5428ae3411c094ab72691793e2998232e55ea5ca4e299993f7c4cf251a",
    "globalRulesHash": "sha256:397b59d360af5b81cb8816ecdf12ad45bbd3c55990df199c67adf9b399fb2987",
    "fragmentHash": "sha256:1827792c9cd24f0838408dfed3d5a3d355e7bbf12d557b4c20b314e12a5966b2"
  },
  "status": "PASS",
  "baseCommit": "76ec4b2a0714e5d5233989204f0a9b756f0145ec",
  "source": "fresh-audit",
  "requirementIds": [
    "S10-REQ-0B0D151D0004",
    "S10-REQ-036E96C6C6B7",
    "S10-REQ-EF10883C12A0",
    "S10-REQ-D1BA9B6A97AF",
    "S10-REQ-26C3EFF9CC0E",
    "S10-REQ-8D8876F1D2F5",
    "S10-REQ-41ED920D124E",
    "S10-REQ-E61AEC3F1A1E",
    "S10-REQ-EEBF4EA0C161",
    "S10-REQ-1E3103DF1E32",
    "S10-REQ-650968D548A4",
    "S10-REQ-273822A1342F",
    "S10-REQ-16AB6A1A52ED",
    "S10-REQ-AD0A29C2D4ED",
    "S10-REQ-2E0D258EEBD8",
    "S10-REQ-ADA36A7DB6F3",
    "S10-REQ-14CA0B6D8F4B",
    "S10-REQ-87E23570D03F",
    "S10-REQ-8CA775F79DAC",
    "S10-REQ-74A58C50E723",
    "S10-REQ-9428C6A993C1"
  ],
  "dependencyAttestations": {
    "S02": "sha256:3a11256b1cb5b9bb41e7d4e204d05db4ff0b77b566bb147b92690f170bd2b23c",
    "S09": "sha256:61bc2bb88db9da098f0ba14ba47f77cc9b0c8ff9ddbdefa43b5b6ee961bcb13d"
  },
  "dependencyPublicDigests": {
    "S02": "sha256:44136fa355b3678a1146ad16f7e8649e94fb4fc21fe77e8310c060f61caaff8a",
    "S09": "sha256:44136fa355b3678a1146ad16f7e8649e94fb4fc21fe77e8310c060f61caaff8a"
  },
  "publicOutput": {},
  "publicDigest": "sha256:44136fa355b3678a1146ad16f7e8649e94fb4fc21fe77e8310c060f61caaff8a",
  "validator": {
    "id": "nvidia:nvidia/nemotron-3-super-120b-a12b",
    "contractHash": "sha256:9149ee3708f6c8b3acd517d21d6ae544c6ff7e4066fcf83ed6bbffac697546ff"
  },
  "tests": [
    {
      "id": "audit-schema",
      "status": "PASS",
      "artifactHash": "sha256:56579ffad80a8a3461b5b9862a19372f676d40b56cfb0df6b8bb6ea378e6e51b"
    }
  ],
  "createdAt": "2026-08-22T09:58:23.819Z",
  "attestationHash": "sha256:48ba4b8e703864356a3d7b7fd72dd1b8467dcb623c45a50e8fcde0283ab13b45"
}
