{
  "schemaVersion": "design-validation/attestation/v2",
  "targetId": "yyeongjin-secret-mcp-use--gdweb-26357",
  "sectionId": "S04",
  "fingerprint": "sha256:06e2223310637b1b499d6a93abd2d54b5fbda0f431b886c4a0cb83d71469833f",
  "triggerSource": {
    "path": "trigger/DESIGN_INDEX_gdweb-26357.md",
    "documentHash": "sha256:f79f163969cbb3520f2741dde3250533a4ff3071dcb772e53dd5802b918e6336",
    "fragmentHash": "sha256:ca7e9376731999781da0ab1ca11c549dfe9b50697fc9e5a9919d62a2de4bb13d"
  },
  "specificationSource": {
    "path": "DESIGN_INDEX_SPECIFICATION.md",
    "documentHash": "sha256:65233a5428ae3411c094ab72691793e2998232e55ea5ca4e299993f7c4cf251a",
    "globalRulesHash": "sha256:397b59d360af5b81cb8816ecdf12ad45bbd3c55990df199c67adf9b399fb2987",
    "fragmentHash": "sha256:88461ea68f3df927926dc3bf47b55853d7157527e98d10ba3f6f039e083882e0"
  },
  "status": "PASS",
  "baseCommit": "266f5f07c1da5374a14edb9f54346a06f0e0ce98",
  "source": "fresh-audit",
  "requirementIds": [
    "S04-REQ-A3078A596290",
    "S04-REQ-2ED9ADDA6730",
    "S04-REQ-C8F8C7966C17",
    "S04-REQ-CEB73FE8B8AC",
    "S04-REQ-9A5763BBB7B0",
    "S04-REQ-E512BD454B52",
    "S04-REQ-9F67C8A07273",
    "S04-REQ-C0A187E54600",
    "S04-REQ-0A8D7D50FA3E",
    "S04-REQ-A9F9613B3F4E",
    "S04-REQ-FCB5FE1D8CAF",
    "S04-REQ-F2B9223177AD",
    "S04-REQ-C38CA5759BBC",
    "S04-REQ-91FD400F9969",
    "S04-REQ-2AC66CBCDAEF",
    "S04-REQ-21EA9E8D863E",
    "S04-REQ-0CAEFF25FE71",
    "S04-REQ-F875AB47C707",
    "S04-REQ-95B534B0895F",
    "S04-REQ-C9EFA06B843B"
  ],
  "dependencyAttestations": {
    "S03": "sha256:4c061610b66afb8b867261323c94a5db97f8f515fcb68a20216733d6358fcb92",
    "S09": "sha256:baa248aa7461d465e30ee5527852e4488eaea97ce12aa346f106052ed143a2b2",
    "S16": "sha256:2a978f795be5b78874b33b7a2822645335b13daf4acb0eac551bcac97e7daeee"
  },
  "dependencyPublicDigests": {
    "S03": "sha256:44136fa355b3678a1146ad16f7e8649e94fb4fc21fe77e8310c060f61caaff8a",
    "S09": "sha256:44136fa355b3678a1146ad16f7e8649e94fb4fc21fe77e8310c060f61caaff8a",
    "S16": "sha256:44136fa355b3678a1146ad16f7e8649e94fb4fc21fe77e8310c060f61caaff8a"
  },
  "publicOutput": {},
  "publicDigest": "sha256:44136fa355b3678a1146ad16f7e8649e94fb4fc21fe77e8310c060f61caaff8a",
  "validator": {
    "id": "nvidia:nvidia/nemotron-3-super-120b-a12b",
    "contractHash": "sha256:aa4e9540e44ff17652b5d52278af4dfcdb5f5d44b60efce15b86935e6920af77"
  },
  "tests": [
    {
      "id": "audit-schema",
      "status": "PASS",
      "artifactHash": "sha256:535cb9245ede66512345816ac4ae71146e8d779e9bc2cbaa77abeeb4c72ed037"
    }
  ],
  "createdAt": "2026-08-22T13:06:52.882Z",
  "attestationHash": "sha256:56d63f0b29af8fd78be937050e25ab52bcd54fb00848b38f37d42a25eeb9034c"
}
