{
  "schemaVersion": "design-validation/attestation/v2",
  "targetId": "yyeongjin-secret-mcp-use--gdweb-26357",
  "sectionId": "S02",
  "fingerprint": "sha256:610f3648717ece5b0308a103b5a8f29befb2e13fc8c4c1ad6f10d74161bbe719",
  "triggerSource": {
    "path": "trigger/DESIGN_INDEX_gdweb-26357.md",
    "documentHash": "sha256:f79f163969cbb3520f2741dde3250533a4ff3071dcb772e53dd5802b918e6336",
    "fragmentHash": "sha256:bbbe4b4c1fb6defd84284d2c4d5fdc617cc499a5695b4f941e73e71f367064f7"
  },
  "specificationSource": {
    "path": "DESIGN_INDEX_SPECIFICATION.md",
    "documentHash": "sha256:65233a5428ae3411c094ab72691793e2998232e55ea5ca4e299993f7c4cf251a",
    "globalRulesHash": "sha256:397b59d360af5b81cb8816ecdf12ad45bbd3c55990df199c67adf9b399fb2987",
    "fragmentHash": "sha256:0784d0b208481d5ddf7a4a680c34f77453b13281a988cab6eb55c8058380514f"
  },
  "status": "PASS",
  "baseCommit": "2d5e77ebf3c8ace103bbb3be241b3592368b8b83",
  "source": "fresh-audit",
  "requirementIds": [
    "S02-REQ-74A7888CC065",
    "S02-REQ-62BFB7F7869A",
    "S02-REQ-E2042B333C55",
    "S02-REQ-BAE42C32D133",
    "S02-REQ-709F115B8DF0",
    "S02-REQ-51D97302068C",
    "S02-REQ-71B1FD7B0462",
    "S02-REQ-BC2E1821B1DC",
    "S02-REQ-5AB362777F36",
    "S02-REQ-8D70223D7D08",
    "S02-REQ-5D0B47EA2762",
    "S02-REQ-0D8C4DF8F50E",
    "S02-REQ-F65770A47A11",
    "S02-REQ-2F8A68B48491",
    "S02-REQ-59E8BA6FF7CE",
    "S02-REQ-8B39946E4107",
    "S02-REQ-010E0E5D5133"
  ],
  "dependencyAttestations": {
    "S01": "sha256:b459ac509c9624d74db0488d3e9d71b51bcf4580fb69dbd00ab39bee888daf65"
  },
  "dependencyPublicDigests": {
    "S01": "sha256:44136fa355b3678a1146ad16f7e8649e94fb4fc21fe77e8310c060f61caaff8a"
  },
  "publicOutput": {},
  "publicDigest": "sha256:44136fa355b3678a1146ad16f7e8649e94fb4fc21fe77e8310c060f61caaff8a",
  "validator": {
    "id": "nvidia:nvidia/nemotron-3-super-120b-a12b",
    "contractHash": "sha256:54f12a698b14240924e874beb31c0cf2e01d6b226e4150358ec697dfff098e2e"
  },
  "tests": [
    {
      "id": "audit-schema",
      "status": "PASS",
      "artifactHash": "sha256:73fb95ec9754589ef8b98e73040552b22b42ecefd0c0af7bff10e89393bfac13"
    }
  ],
  "createdAt": "2026-08-22T16:35:20.561Z",
  "attestationHash": "sha256:fba2d7da6ed32caa4d4948d3f20c55dda9643c1c0a623b4aa7901ff1102d9c01"
}
