{
  "schemaVersion": "design-validation/attestation/v2",
  "targetId": "yyeongjin-secret-mcp-use--gdweb-26357",
  "sectionId": "S02",
  "fingerprint": "sha256:6e36ff009dc281d94c2a31aca30c7379eb48c2748090ca2ff61e6abec84d4c04",
  "triggerSource": {
    "path": "trigger/DESIGN_INDEX_gdweb-26357.md",
    "documentHash": "sha256:f79f163969cbb3520f2741dde3250533a4ff3071dcb772e53dd5802b918e6336",
    "fragmentHash": "sha256:bbbe4b4c1fb6defd84284d2c4d5fdc617cc499a5695b4f941e73e71f367064f7"
  },
  "specificationSource": {
    "path": "DESIGN_INDEX_SPECIFICATION.md",
    "documentHash": "sha256:65233a5428ae3411c094ab72691793e2998232e55ea5ca4e299993f7c4cf251a",
    "globalRulesHash": "sha256:397b59d360af5b81cb8816ecdf12ad45bbd3c55990df199c67adf9b399fb2987",
    "fragmentHash": "sha256:0784d0b208481d5ddf7a4a680c34f77453b13281a988cab6eb55c8058380514f"
  },
  "status": "PASS",
  "baseCommit": "26e48d13caf0ec7fda8f9e188689004da6230406",
  "source": "fresh-audit",
  "requirementIds": [
    "S02-REQ-74A7888CC065",
    "S02-REQ-62BFB7F7869A",
    "S02-REQ-E2042B333C55",
    "S02-REQ-BAE42C32D133",
    "S02-REQ-709F115B8DF0",
    "S02-REQ-51D97302068C",
    "S02-REQ-71B1FD7B0462",
    "S02-REQ-BC2E1821B1DC",
    "S02-REQ-5AB362777F36",
    "S02-REQ-8D70223D7D08",
    "S02-REQ-5D0B47EA2762",
    "S02-REQ-0D8C4DF8F50E",
    "S02-REQ-F65770A47A11",
    "S02-REQ-2F8A68B48491",
    "S02-REQ-59E8BA6FF7CE",
    "S02-REQ-8B39946E4107",
    "S02-REQ-010E0E5D5133"
  ],
  "dependencyAttestations": {
    "S01": "sha256:250bebecf963746c9bfc448fbf36a9fb9f5e5c2fd31a828452b51693d7b8a29b"
  },
  "dependencyPublicDigests": {
    "S01": "sha256:44136fa355b3678a1146ad16f7e8649e94fb4fc21fe77e8310c060f61caaff8a"
  },
  "publicOutput": {},
  "publicDigest": "sha256:44136fa355b3678a1146ad16f7e8649e94fb4fc21fe77e8310c060f61caaff8a",
  "validator": {
    "id": "nvidia:nvidia/nemotron-3-super-120b-a12b",
    "contractHash": "sha256:6fa46b3eb858aec6991f750e73c434ec0b125a288f427c2a2d601ab5a03d66dc"
  },
  "tests": [
    {
      "id": "audit-schema",
      "status": "PASS",
      "artifactHash": "sha256:c42a9cac760eca36582332f14358197c29217b107577e6b8a1b0a5f0525ea61e"
    }
  ],
  "createdAt": "2026-08-21T17:15:10.232Z",
  "attestationHash": "sha256:71ee0fd192ae387c3962526a7c52a9f19f11bcb108382c1d4d52692f0db09f16"
}
