{
  "schemaVersion": "design-validation/attestation/v2",
  "targetId": "yyeongjin-secret-mcp-use--gdweb-26357",
  "sectionId": "S02",
  "fingerprint": "sha256:0c29bd52bc33c2b44bb00b320011224e818c898cc3de8a49efa81df59400795e",
  "triggerSource": {
    "path": "trigger/DESIGN_INDEX_gdweb-26357.md",
    "documentHash": "sha256:f79f163969cbb3520f2741dde3250533a4ff3071dcb772e53dd5802b918e6336",
    "fragmentHash": "sha256:bbbe4b4c1fb6defd84284d2c4d5fdc617cc499a5695b4f941e73e71f367064f7"
  },
  "specificationSource": {
    "path": "DESIGN_INDEX_SPECIFICATION.md",
    "documentHash": "sha256:65233a5428ae3411c094ab72691793e2998232e55ea5ca4e299993f7c4cf251a",
    "globalRulesHash": "sha256:397b59d360af5b81cb8816ecdf12ad45bbd3c55990df199c67adf9b399fb2987",
    "fragmentHash": "sha256:0784d0b208481d5ddf7a4a680c34f77453b13281a988cab6eb55c8058380514f"
  },
  "status": "PASS",
  "baseCommit": "951b05e1c07d954f6380442f31a1889e0f31df2c",
  "source": "fresh-audit",
  "requirementIds": [
    "S02-REQ-74A7888CC065",
    "S02-REQ-62BFB7F7869A",
    "S02-REQ-E2042B333C55",
    "S02-REQ-BAE42C32D133",
    "S02-REQ-709F115B8DF0",
    "S02-REQ-51D97302068C",
    "S02-REQ-71B1FD7B0462",
    "S02-REQ-BC2E1821B1DC",
    "S02-REQ-5AB362777F36",
    "S02-REQ-8D70223D7D08",
    "S02-REQ-5D0B47EA2762",
    "S02-REQ-0D8C4DF8F50E",
    "S02-REQ-F65770A47A11",
    "S02-REQ-2F8A68B48491",
    "S02-REQ-59E8BA6FF7CE",
    "S02-REQ-8B39946E4107",
    "S02-REQ-010E0E5D5133"
  ],
  "dependencyAttestations": {
    "S01": "sha256:5649708f4f44adb8fb68479f3e807caa1f02ab67d93ff508dd040f1dd41a21f6"
  },
  "dependencyPublicDigests": {
    "S01": "sha256:44136fa355b3678a1146ad16f7e8649e94fb4fc21fe77e8310c060f61caaff8a"
  },
  "publicOutput": {},
  "publicDigest": "sha256:44136fa355b3678a1146ad16f7e8649e94fb4fc21fe77e8310c060f61caaff8a",
  "validator": {
    "id": "nvidia:nvidia/nemotron-3-super-120b-a12b",
    "contractHash": "sha256:8619860b8a44d4e9f0bc4cac158b93bf559d2514f7e757e8387eb3bb69d810e6"
  },
  "tests": [
    {
      "id": "audit-schema",
      "status": "PASS",
      "artifactHash": "sha256:cae0a3f25a50af260b51badedce4647b81b1ebca4dbb4e5832240872b538391f"
    }
  ],
  "createdAt": "2026-08-22T14:12:18.464Z",
  "attestationHash": "sha256:8250a757451202566cd7f0a5fea4e6886253ea9c262394e7ca8a897922d9b6db"
}
