{
  "schemaVersion": "design-validation/attestation/v2",
  "targetId": "yyeongjin-secret-mcp-use--gdweb-26357",
  "sectionId": "S13",
  "fingerprint": "sha256:740897c1aa6f01217f6c8ca09f34caf61169f336100714f7f34eba7b9cc3bd4d",
  "triggerSource": {
    "path": "trigger/DESIGN_INDEX_gdweb-26357.md",
    "documentHash": "sha256:f79f163969cbb3520f2741dde3250533a4ff3071dcb772e53dd5802b918e6336",
    "fragmentHash": "sha256:a3028b48753b936c77a756edfc6001b7c9c272be5514f446bb1b6adc998790bc"
  },
  "specificationSource": {
    "path": "DESIGN_INDEX_SPECIFICATION.md",
    "documentHash": "sha256:65233a5428ae3411c094ab72691793e2998232e55ea5ca4e299993f7c4cf251a",
    "globalRulesHash": "sha256:397b59d360af5b81cb8816ecdf12ad45bbd3c55990df199c67adf9b399fb2987",
    "fragmentHash": "sha256:eb1b4665adad248b170d60b108c5a16191ae9cb719872fe0e3bc4b88801eb189"
  },
  "status": "PASS",
  "baseCommit": "7689e42e9f5db897a627ea3c5e33f4327deba04f",
  "source": "fresh-audit",
  "requirementIds": [
    "S13-REQ-5CC47DF2082D",
    "S13-REQ-4BA80A004917",
    "S13-REQ-4C0996846603",
    "S13-REQ-83514D32FBB5",
    "S13-REQ-675CB17B4D67",
    "S13-REQ-0209FEB44C37",
    "S13-REQ-1DDE7D2F613D",
    "S13-REQ-422DFE79ABAD",
    "S13-REQ-C4310463DC21",
    "S13-REQ-FE166E790079",
    "S13-REQ-74D129B5D7D3",
    "S13-REQ-7DB1278D3D3B",
    "S13-REQ-DE61BB53154C",
    "S13-REQ-DC2F1C9100CD",
    "S13-REQ-850706EF98FF",
    "S13-REQ-0B90ADB60846"
  ],
  "dependencyAttestations": {
    "S05": "sha256:ea5fb2aea177929c442e13046725e3d26ce6eb97323a5b08de7de672a288cb17",
    "S08": "sha256:01f2e0ca86082ae3af1369d28ecbefcc9e7706917ff15deb52c1f98aad2517dc",
    "S09": "sha256:01a2b4468f5a8a55e9bcb94ecfedc218d87ddb2af932168e55e52c111d001612",
    "S12": "sha256:422bd58f8b2dedad21a44618471df4474d3fa5ca7e68572fc5e03eefe69f702a"
  },
  "dependencyPublicDigests": {
    "S05": "sha256:44136fa355b3678a1146ad16f7e8649e94fb4fc21fe77e8310c060f61caaff8a",
    "S08": "sha256:44136fa355b3678a1146ad16f7e8649e94fb4fc21fe77e8310c060f61caaff8a",
    "S09": "sha256:44136fa355b3678a1146ad16f7e8649e94fb4fc21fe77e8310c060f61caaff8a",
    "S12": "sha256:44136fa355b3678a1146ad16f7e8649e94fb4fc21fe77e8310c060f61caaff8a"
  },
  "publicOutput": {},
  "publicDigest": "sha256:44136fa355b3678a1146ad16f7e8649e94fb4fc21fe77e8310c060f61caaff8a",
  "validator": {
    "id": "nvidia:nvidia/nemotron-3-super-120b-a12b",
    "contractHash": "sha256:8619860b8a44d4e9f0bc4cac158b93bf559d2514f7e757e8387eb3bb69d810e6"
  },
  "tests": [
    {
      "id": "audit-schema",
      "status": "PASS",
      "artifactHash": "sha256:3c295bba438dfbb51c38817af1271f8a7ca7c81429fcfb34f5402443a693ca53"
    }
  ],
  "createdAt": "2026-08-22T14:01:28.293Z",
  "attestationHash": "sha256:46390fbd1c87570a4fb27f93364cd0babe7cf81f2fe6cb8124f791070bbc2529"
}
