{
  "schemaVersion": "design-validation/attestation/v2",
  "targetId": "yyeongjin-secret-mcp-use--gdweb-26357",
  "sectionId": "S16",
  "fingerprint": "sha256:4793b876f757f7120d993f7c950bd184e30af560af77c5105356bc213545c50b",
  "triggerSource": {
    "path": "trigger/DESIGN_INDEX_gdweb-26357.md",
    "documentHash": "sha256:f79f163969cbb3520f2741dde3250533a4ff3071dcb772e53dd5802b918e6336",
    "fragmentHash": "sha256:da29f874cb15a55c942ba1db0456a75f23087807c0d60ac26a6e5041e66050fc"
  },
  "specificationSource": {
    "path": "DESIGN_INDEX_SPECIFICATION.md",
    "documentHash": "sha256:65233a5428ae3411c094ab72691793e2998232e55ea5ca4e299993f7c4cf251a",
    "globalRulesHash": "sha256:397b59d360af5b81cb8816ecdf12ad45bbd3c55990df199c67adf9b399fb2987",
    "fragmentHash": "sha256:0934c64fb4493f8f134e95e6addaf7bc47a6334b2a94ef072d9e8bfa2caef574"
  },
  "status": "PASS",
  "baseCommit": "9697ad90257e22f1c4a699728666c3b2f5f55b9f",
  "source": "fresh-audit",
  "requirementIds": [
    "S16-REQ-E88F707FCAE6",
    "S16-REQ-2BF7F48EA022",
    "S16-REQ-2CFCFD11CA52",
    "S16-REQ-BC63C8CBC7F3",
    "S16-REQ-DD3A8EAC0945",
    "S16-REQ-054EAFE865EF",
    "S16-REQ-C5EA958E1573",
    "S16-REQ-E1B853871565",
    "S16-REQ-EE403928B3D8",
    "S16-REQ-2EBC876E7983",
    "S16-REQ-E567DFAB46C7",
    "S16-REQ-ADA579595DF2",
    "S16-REQ-9FCB1A1122C3",
    "S16-REQ-5EAFEBE9F308",
    "S16-REQ-E50AB5D4D29F",
    "S16-REQ-D678CEF2F1DA",
    "S16-REQ-3A48DD254A4C",
    "S16-REQ-F9648D2A6886",
    "S16-REQ-2F67B4DE15BD",
    "S16-REQ-F885679EB6E6",
    "S16-REQ-1C06F691792B",
    "S16-REQ-8B0EFC543313",
    "S16-REQ-8CE43AA4E007",
    "S16-REQ-FF97F0BD6603",
    "S16-REQ-0FD09E936841",
    "S16-REQ-A084CEB20A20",
    "S16-REQ-FFEF9F0F4440",
    "S16-REQ-55F6463249F8",
    "S16-REQ-2CACEEE0AD17",
    "S16-REQ-D53A52D0C476",
    "S16-REQ-7B96CEEFB0E6",
    "S16-REQ-5BD5983755F8",
    "S16-REQ-0E544E6BB53F",
    "S16-REQ-566DBEF9D934",
    "S16-REQ-1795DDB38BB9",
    "S16-REQ-1EEA57EB5BF8",
    "S16-REQ-EE0DBCB02FC7",
    "S16-REQ-676916C56D73",
    "S16-REQ-E8F9BB7EED02",
    "S16-REQ-E6BC09026E89",
    "S16-REQ-D6094E781DDB",
    "S16-REQ-3B81B4A654B1",
    "S16-REQ-22335D1350FA",
    "S16-REQ-2F67B4DE15BD",
    "S16-REQ-5970585BF212",
    "S16-REQ-8B29E4F7F509",
    "S16-REQ-F2252B68C4F0",
    "S16-REQ-1C30475B41F9",
    "S16-REQ-F5D0E0BAD6B7",
    "S16-REQ-75E444A5CDA7",
    "S16-REQ-7ED450CC2E0C",
    "S16-REQ-A1DBD755F75B",
    "S16-REQ-0627019D00E9",
    "S16-REQ-65D9DA694046",
    "S16-REQ-0F957CBA42AB",
    "S16-REQ-40EB15E531FA",
    "S16-REQ-A9ABCDBD2A1E",
    "S16-REQ-244621088762",
    "S16-REQ-1751436C6201",
    "S16-REQ-1DB91328A934"
  ],
  "dependencyAttestations": {
    "S01": "sha256:6fad86f9f770a038e60b2933a6bb6ebee584bbc3ca0f68adf0e3dad06c83847f",
    "S03": "sha256:83af36bc931617ff5234747defef07b5610217d295b64522ad50450341ccab19",
    "S15": "sha256:c42e70d954d51ce8b7908dbbee3f3128431be200115d3e9657d0c831ee7f7299"
  },
  "dependencyPublicDigests": {
    "S01": "sha256:44136fa355b3678a1146ad16f7e8649e94fb4fc21fe77e8310c060f61caaff8a",
    "S03": "sha256:44136fa355b3678a1146ad16f7e8649e94fb4fc21fe77e8310c060f61caaff8a",
    "S15": "sha256:44136fa355b3678a1146ad16f7e8649e94fb4fc21fe77e8310c060f61caaff8a"
  },
  "publicOutput": {},
  "publicDigest": "sha256:44136fa355b3678a1146ad16f7e8649e94fb4fc21fe77e8310c060f61caaff8a",
  "validator": {
    "id": "nvidia:nvidia/nemotron-3-super-120b-a12b",
    "contractHash": "sha256:81412b40507c557c36953349efd29d28d1cc8eccfa104b6dc8a8ac3c6f90d7e2"
  },
  "tests": [
    {
      "id": "audit-schema",
      "status": "PASS",
      "artifactHash": "sha256:be7ba2358ba1c697a88359edf2c5328ec3d87c7c59c1e13e4d2e187d1bf89fb9"
    }
  ],
  "createdAt": "2026-08-22T14:48:16.403Z",
  "attestationHash": "sha256:3ef4c44605fda837badcd4d9d90d5b0218284b36d25825f344f2db5aa490bc44"
}
