{
  "schemaVersion": "design-validation/attestation/v2",
  "targetId": "yyeongjin-secret-mcp-use--gdweb-26357",
  "sectionId": "S03",
  "fingerprint": "sha256:3484d764da7ac0f9b1cef149581623fe6b99d328adbfa6f894700ede14d06210",
  "triggerSource": {
    "path": "trigger/DESIGN_INDEX_gdweb-26357.md",
    "documentHash": "sha256:f79f163969cbb3520f2741dde3250533a4ff3071dcb772e53dd5802b918e6336",
    "fragmentHash": "sha256:4b6b1df256ecdb68282ddea2e640dd25f8ab9421e069f6e81d905c01a4e7c63f"
  },
  "specificationSource": {
    "path": "DESIGN_INDEX_SPECIFICATION.md",
    "documentHash": "sha256:65233a5428ae3411c094ab72691793e2998232e55ea5ca4e299993f7c4cf251a",
    "globalRulesHash": "sha256:397b59d360af5b81cb8816ecdf12ad45bbd3c55990df199c67adf9b399fb2987",
    "fragmentHash": "sha256:ab2d64cca87cedde7b0b4ec3f37dcb7c551533c8eed77e7620dc8915f47a8867"
  },
  "status": "PASS",
  "baseCommit": "f1a89c50192dd9583e21d970a6ace4df15bfcff5",
  "source": "fresh-audit",
  "requirementIds": [
    "S03-REQ-8E97A3537456",
    "S03-REQ-92A16BF546FB",
    "S03-REQ-83C46F4E1D08",
    "S03-REQ-51EC990297A6",
    "S03-REQ-99A97C6CB73E",
    "S03-REQ-EBA62230BE86",
    "S03-REQ-17A802FF800E"
  ],
  "dependencyAttestations": {
    "S01": "sha256:7c4928a99091e42b852e464ed849beb60f43b56f026678e7ad01d22bf98399e6",
    "S02": "sha256:a8f72d0dbca51bafded6d4125dd95cdcf5bc65ef4982e000aa451a8c4e7980e5"
  },
  "dependencyPublicDigests": {
    "S01": "sha256:44136fa355b3678a1146ad16f7e8649e94fb4fc21fe77e8310c060f61caaff8a",
    "S02": "sha256:44136fa355b3678a1146ad16f7e8649e94fb4fc21fe77e8310c060f61caaff8a"
  },
  "publicOutput": {},
  "publicDigest": "sha256:44136fa355b3678a1146ad16f7e8649e94fb4fc21fe77e8310c060f61caaff8a",
  "validator": {
    "id": "nvidia:nvidia/nemotron-3-super-120b-a12b",
    "contractHash": "sha256:9babd636a9695bc1d9021fcc70301282618914c4ef1f0b627a8f3596dcdfa312"
  },
  "tests": [
    {
      "id": "audit-schema",
      "status": "PASS",
      "artifactHash": "sha256:44acda1deb53ba1d039e28f4acb9a452139b02698ea9ffda762f03a7bc528605"
    }
  ],
  "createdAt": "2026-08-22T19:41:07.402Z",
  "attestationHash": "sha256:777f2a31fa515e732d2bd90d5649cf34b27fa5f6b6fe99b42ca3045e3e4ca5d4"
}
