{
  "schemaVersion": "design-validation/attestation/v2",
  "targetId": "yyeongjin-secret-mcp-use--gdweb-26357",
  "sectionId": "S03",
  "fingerprint": "sha256:9b68f8aa0e8e98b5f7771efd1b3974ccd82be196af2f7c011056d9a5c6a8a770",
  "triggerSource": {
    "path": "trigger/DESIGN_INDEX_gdweb-26357.md",
    "documentHash": "sha256:f79f163969cbb3520f2741dde3250533a4ff3071dcb772e53dd5802b918e6336",
    "fragmentHash": "sha256:4b6b1df256ecdb68282ddea2e640dd25f8ab9421e069f6e81d905c01a4e7c63f"
  },
  "specificationSource": {
    "path": "DESIGN_INDEX_SPECIFICATION.md",
    "documentHash": "sha256:65233a5428ae3411c094ab72691793e2998232e55ea5ca4e299993f7c4cf251a",
    "globalRulesHash": "sha256:397b59d360af5b81cb8816ecdf12ad45bbd3c55990df199c67adf9b399fb2987",
    "fragmentHash": "sha256:ab2d64cca87cedde7b0b4ec3f37dcb7c551533c8eed77e7620dc8915f47a8867"
  },
  "status": "PASS",
  "baseCommit": "2cafbf7edc4e3eb7619fa4be72bcf46210b1012b",
  "source": "fresh-audit",
  "requirementIds": [
    "S03-REQ-8E97A3537456",
    "S03-REQ-92A16BF546FB",
    "S03-REQ-83C46F4E1D08",
    "S03-REQ-51EC990297A6",
    "S03-REQ-99A97C6CB73E",
    "S03-REQ-EBA62230BE86",
    "S03-REQ-17A802FF800E"
  ],
  "dependencyAttestations": {
    "S01": "sha256:b7331d0d12c39a2dfdd8556b87c5138803b3672306b9038dd8dbc0378ad1e4f1",
    "S02": "sha256:aab55c708f0048668f129f6333d7827d8c4544f99b9c8c8c132f9cc62bc9bc70"
  },
  "dependencyPublicDigests": {
    "S01": "sha256:44136fa355b3678a1146ad16f7e8649e94fb4fc21fe77e8310c060f61caaff8a",
    "S02": "sha256:44136fa355b3678a1146ad16f7e8649e94fb4fc21fe77e8310c060f61caaff8a"
  },
  "publicOutput": {},
  "publicDigest": "sha256:44136fa355b3678a1146ad16f7e8649e94fb4fc21fe77e8310c060f61caaff8a",
  "validator": {
    "id": "nvidia:nvidia/nemotron-3-super-120b-a12b",
    "contractHash": "sha256:9ba9db91860e85a9129a4c11348deb756604c9c00e73245d192adcf072c9b1b0"
  },
  "tests": [
    {
      "id": "audit-schema",
      "status": "PASS",
      "artifactHash": "sha256:347956c38ce3f74abe47eb0acd732d34ccea56701547323a84c2b672fc269d18"
    }
  ],
  "createdAt": "2026-08-21T17:45:17.637Z",
  "attestationHash": "sha256:85b07349c2f5eacd885ce7be0bfee74462bc6753d35e925f94eeeb88b3b084ee"
}
