{
  "schemaVersion": "design-validation/attestation/v2",
  "targetId": "yyeongjin-secret-mcp-use--gdweb-26357",
  "sectionId": "S03",
  "fingerprint": "sha256:0ebb9bb712754419d3a7a1f48136849ef11fedfd5ad941833c0cd91d1e876f43",
  "triggerSource": {
    "path": "trigger/DESIGN_INDEX_gdweb-26357.md",
    "documentHash": "sha256:f79f163969cbb3520f2741dde3250533a4ff3071dcb772e53dd5802b918e6336",
    "fragmentHash": "sha256:4b6b1df256ecdb68282ddea2e640dd25f8ab9421e069f6e81d905c01a4e7c63f"
  },
  "specificationSource": {
    "path": "DESIGN_INDEX_SPECIFICATION.md",
    "documentHash": "sha256:65233a5428ae3411c094ab72691793e2998232e55ea5ca4e299993f7c4cf251a",
    "globalRulesHash": "sha256:397b59d360af5b81cb8816ecdf12ad45bbd3c55990df199c67adf9b399fb2987",
    "fragmentHash": "sha256:ab2d64cca87cedde7b0b4ec3f37dcb7c551533c8eed77e7620dc8915f47a8867"
  },
  "status": "PASS",
  "baseCommit": "266f5f07c1da5374a14edb9f54346a06f0e0ce98",
  "source": "fresh-audit",
  "requirementIds": [
    "S03-REQ-8E97A3537456",
    "S03-REQ-92A16BF546FB",
    "S03-REQ-83C46F4E1D08",
    "S03-REQ-51EC990297A6",
    "S03-REQ-99A97C6CB73E",
    "S03-REQ-EBA62230BE86",
    "S03-REQ-17A802FF800E"
  ],
  "dependencyAttestations": {
    "S01": "sha256:f5f8444a4f6a4e460cab3f9c85dc663418c61d1c656289bfead8c6c0c20bf3b0",
    "S02": "sha256:fc6edc84279f8b95f7162c45d7c1e5ac36e310a8b6d1f053e23817b3b8d4806a"
  },
  "dependencyPublicDigests": {
    "S01": "sha256:44136fa355b3678a1146ad16f7e8649e94fb4fc21fe77e8310c060f61caaff8a",
    "S02": "sha256:44136fa355b3678a1146ad16f7e8649e94fb4fc21fe77e8310c060f61caaff8a"
  },
  "publicOutput": {},
  "publicDigest": "sha256:44136fa355b3678a1146ad16f7e8649e94fb4fc21fe77e8310c060f61caaff8a",
  "validator": {
    "id": "nvidia:nvidia/nemotron-3-super-120b-a12b",
    "contractHash": "sha256:aa4e9540e44ff17652b5d52278af4dfcdb5f5d44b60efce15b86935e6920af77"
  },
  "tests": [
    {
      "id": "audit-schema",
      "status": "PASS",
      "artifactHash": "sha256:6300dea09668b582cf42e8e75c41a1ba3193aa76934a5ef8b7a189ec8d7e928f"
    }
  ],
  "createdAt": "2026-08-22T13:06:52.881Z",
  "attestationHash": "sha256:4c061610b66afb8b867261323c94a5db97f8f515fcb68a20216733d6358fcb92"
}
