{
  "schemaVersion": "design-validation/attestation/v2",
  "targetId": "yyeongjin-secret-mcp-use--gdweb-26357",
  "sectionId": "S02",
  "fingerprint": "sha256:8bcebdf326672dffe8c3c501e9aaaae910e61f501b52d584c3c39c25b49bcf3b",
  "triggerSource": {
    "path": "trigger/DESIGN_INDEX_gdweb-26357.md",
    "documentHash": "sha256:f79f163969cbb3520f2741dde3250533a4ff3071dcb772e53dd5802b918e6336",
    "fragmentHash": "sha256:bbbe4b4c1fb6defd84284d2c4d5fdc617cc499a5695b4f941e73e71f367064f7"
  },
  "specificationSource": {
    "path": "DESIGN_INDEX_SPECIFICATION.md",
    "documentHash": "sha256:65233a5428ae3411c094ab72691793e2998232e55ea5ca4e299993f7c4cf251a",
    "globalRulesHash": "sha256:397b59d360af5b81cb8816ecdf12ad45bbd3c55990df199c67adf9b399fb2987",
    "fragmentHash": "sha256:0784d0b208481d5ddf7a4a680c34f77453b13281a988cab6eb55c8058380514f"
  },
  "status": "PASS",
  "baseCommit": "d1bc14b5b396d8c32c8e6eb57706fb305978b1c2",
  "source": "fresh-audit",
  "requirementIds": [
    "S02-REQ-74A7888CC065",
    "S02-REQ-62BFB7F7869A",
    "S02-REQ-E2042B333C55",
    "S02-REQ-BAE42C32D133",
    "S02-REQ-709F115B8DF0",
    "S02-REQ-51D97302068C",
    "S02-REQ-71B1FD7B0462",
    "S02-REQ-BC2E1821B1DC",
    "S02-REQ-5AB362777F36",
    "S02-REQ-8D70223D7D08",
    "S02-REQ-5D0B47EA2762",
    "S02-REQ-0D8C4DF8F50E",
    "S02-REQ-F65770A47A11",
    "S02-REQ-2F8A68B48491",
    "S02-REQ-59E8BA6FF7CE",
    "S02-REQ-8B39946E4107",
    "S02-REQ-010E0E5D5133"
  ],
  "dependencyAttestations": {
    "S01": "sha256:e3f90203efb6180b8251eef5d4d26a51bc57214b3344ee5f84ba6df450298f48"
  },
  "dependencyPublicDigests": {
    "S01": "sha256:44136fa355b3678a1146ad16f7e8649e94fb4fc21fe77e8310c060f61caaff8a"
  },
  "publicOutput": {},
  "publicDigest": "sha256:44136fa355b3678a1146ad16f7e8649e94fb4fc21fe77e8310c060f61caaff8a",
  "validator": {
    "id": "nvidia:nvidia/nemotron-3-super-120b-a12b",
    "contractHash": "sha256:aa4e9540e44ff17652b5d52278af4dfcdb5f5d44b60efce15b86935e6920af77"
  },
  "tests": [
    {
      "id": "audit-schema",
      "status": "PASS",
      "artifactHash": "sha256:911ec0fd5076cf01d02b1166a8dd554fea079db9a21bec70cc91e6b8c1258408"
    }
  ],
  "createdAt": "2026-08-22T13:15:53.548Z",
  "attestationHash": "sha256:b572be41de5e74a04b9a9c267053d40fde9ff6170dd2bb335df1e939872ab9ef"
}
