{
  "schemaVersion": "design-validation/attestation/v2",
  "targetId": "yyeongjin-secret-mcp-use--gdweb-26357",
  "sectionId": "S11",
  "fingerprint": "sha256:997739e3fa6c828381e85730024020446f580542d28d49e68291965f2a878946",
  "triggerSource": {
    "path": "trigger/DESIGN_INDEX_gdweb-26357.md",
    "documentHash": "sha256:f79f163969cbb3520f2741dde3250533a4ff3071dcb772e53dd5802b918e6336",
    "fragmentHash": "sha256:a5a6bb7befd5b0a2a5c4f896ea37115c56248e141a09b0e77d0a75f1eed6284c"
  },
  "specificationSource": {
    "path": "DESIGN_INDEX_SPECIFICATION.md",
    "documentHash": "sha256:65233a5428ae3411c094ab72691793e2998232e55ea5ca4e299993f7c4cf251a",
    "globalRulesHash": "sha256:397b59d360af5b81cb8816ecdf12ad45bbd3c55990df199c67adf9b399fb2987",
    "fragmentHash": "sha256:0714a5ce49d33ef82479f08378273c6cbdef478ad4003817d2795fedc0673fe1"
  },
  "status": "PASS",
  "baseCommit": "a73e70936bd3199364977414e01e557197620e17",
  "source": "fresh-audit",
  "requirementIds": [
    "S11-REQ-119EA901744C",
    "S11-REQ-B53CC119039D",
    "S11-REQ-F1582EF0CB9B",
    "S11-REQ-EEFC841A575F",
    "S11-REQ-5066045276EA",
    "S11-REQ-36E99D16142D",
    "S11-REQ-8570CF8A9AA9",
    "S11-REQ-606FF5935702",
    "S11-REQ-41C00A46BE15",
    "S11-REQ-5A7585A9DA88",
    "S11-REQ-76CD95BC5EBF",
    "S11-REQ-665CF54170E9",
    "S11-REQ-A9E784F23665",
    "S11-REQ-8ADA84F8CCC9",
    "S11-REQ-0E671080B45B"
  ],
  "dependencyAttestations": {
    "S02": "sha256:ab31acd3a4100496f301d9e2d1ec76bc08b27b07545ac99d9b612ed2c0a3e830",
    "S03": "sha256:2b5fb57354d8920c125b711e5eea4595d7e48baeb160ff2c3c2b1e4266a374e3"
  },
  "dependencyPublicDigests": {
    "S02": "sha256:44136fa355b3678a1146ad16f7e8649e94fb4fc21fe77e8310c060f61caaff8a",
    "S03": "sha256:44136fa355b3678a1146ad16f7e8649e94fb4fc21fe77e8310c060f61caaff8a"
  },
  "publicOutput": {},
  "publicDigest": "sha256:44136fa355b3678a1146ad16f7e8649e94fb4fc21fe77e8310c060f61caaff8a",
  "validator": {
    "id": "nvidia:nvidia/nemotron-3-super-120b-a12b",
    "contractHash": "sha256:65021547d83414ad8b7ae31c93dbb68e23cd67a5cade8647ac7b84f05433af9b"
  },
  "tests": [
    {
      "id": "audit-schema",
      "status": "PASS",
      "artifactHash": "sha256:458255ec6ce224f349609e837224effd86a41e56e9682b6220c42b188ea5714f"
    }
  ],
  "createdAt": "2026-08-21T17:26:20.650Z",
  "attestationHash": "sha256:590d0d4aeecb36e7f32edf74bd2d1077ef1f19b9030e9c8e04641f0da4cb9b5a"
}
