{
  "schemaVersion": "design-validation/attestation/v2",
  "targetId": "yyeongjin-secret-mcp-use--gdweb-26357",
  "sectionId": "S08",
  "fingerprint": "sha256:cdd6d118738160c4e9151fa469b3f7f2c587f736aee0f4fcfb219c0178c4fb1d",
  "triggerSource": {
    "path": "trigger/DESIGN_INDEX_gdweb-26357.md",
    "documentHash": "sha256:f79f163969cbb3520f2741dde3250533a4ff3071dcb772e53dd5802b918e6336",
    "fragmentHash": "sha256:3b8b13f1de0056fe391c72f09dc4294cd26172a002ba7b5ca8525719896ab330"
  },
  "specificationSource": {
    "path": "DESIGN_INDEX_SPECIFICATION.md",
    "documentHash": "sha256:65233a5428ae3411c094ab72691793e2998232e55ea5ca4e299993f7c4cf251a",
    "globalRulesHash": "sha256:397b59d360af5b81cb8816ecdf12ad45bbd3c55990df199c67adf9b399fb2987",
    "fragmentHash": "sha256:b4eb761fc6873cad4ed74766a3a4ea3afaa639dcbffb32ae4ecedc2e879536c0"
  },
  "status": "PASS",
  "baseCommit": "7689e42e9f5db897a627ea3c5e33f4327deba04f",
  "source": "fresh-audit",
  "requirementIds": [
    "S08-REQ-20DF0D5EAEDB",
    "S08-REQ-2C89180FDE31",
    "S08-REQ-50536ED43EE1",
    "S08-REQ-B1CECDF386EB",
    "S08-REQ-34DA22270FC7",
    "S08-REQ-EAFD41A04227",
    "S08-REQ-58AD83277815",
    "S08-REQ-5212A09BCB55",
    "S08-REQ-10C3CB36AAAB",
    "S08-REQ-CBCF65DF14E5",
    "S08-REQ-B008657C851A",
    "S08-REQ-E6D1240EA1AF",
    "S08-REQ-0E3F321E6763",
    "S08-REQ-233C7DA14758",
    "S08-REQ-4896320CF888",
    "S08-REQ-A86D7A8AF31C",
    "S08-REQ-DFA8B45BD648",
    "S08-REQ-919063992736",
    "S08-REQ-716F92E85339",
    "S08-REQ-4896320CF888",
    "S08-REQ-3A48DD254A4C",
    "S08-REQ-E56B9AC6D869",
    "S08-REQ-0E3F321E6763",
    "S08-REQ-AE5DC244A2FF",
    "S08-REQ-4896320CF888",
    "S08-REQ-F885679EB6E6",
    "S08-REQ-081BE3DE1C8C",
    "S08-REQ-0E3F321E6763",
    "S08-REQ-F5F838755C53",
    "S08-REQ-4896320CF888",
    "S08-REQ-3A48DD254A4C",
    "S08-REQ-031F62EAFE0D",
    "S08-REQ-0E3F321E6763",
    "S08-REQ-C47EA68D1BCE",
    "S08-REQ-4F073112F129",
    "S08-REQ-DAB2E593DF2A",
    "S08-REQ-A740266780B8",
    "S08-REQ-4254037964A6",
    "S08-REQ-7C66A1B1E9E4",
    "S08-REQ-F63E7CD28F44",
    "S08-REQ-481860434B50",
    "S08-REQ-C02D9A5257D5",
    "S08-REQ-F11E28339C6F",
    "S08-REQ-647174050577",
    "S08-REQ-E9F7878AC856",
    "S08-REQ-A5DDD38391D5",
    "S08-REQ-B665EF9FE695",
    "S08-REQ-EE1C053497F2",
    "S08-REQ-2427A9D51A58",
    "S08-REQ-3838A576E49B",
    "S08-REQ-D5C2BAE3BC28",
    "S08-REQ-BAB5AEB86777",
    "S08-REQ-27650B76EF33",
    "S08-REQ-D175FB15C0E5",
    "S08-REQ-07842D2062D6"
  ],
  "dependencyAttestations": {
    "S06": "sha256:7d7f2d6039ff7ac6b5097c6e810cd586027b2b42dae57df7009730e9fbd8324a",
    "S07": "sha256:0b1c2b99f5ce1385499364606a8cff87a836344f1eefa8b8af95cedaa3bd4688",
    "S15": "sha256:54d75d4f99c88ddbea59b8b70b6873c904cc36ea66af0a8162d8ef216947f0e4",
    "S16": "sha256:940a9c71bf588a3702cc7acfe5e653772bb74d1e7b3aed85f63df0bcf67cf214"
  },
  "dependencyPublicDigests": {
    "S06": "sha256:44136fa355b3678a1146ad16f7e8649e94fb4fc21fe77e8310c060f61caaff8a",
    "S07": "sha256:44136fa355b3678a1146ad16f7e8649e94fb4fc21fe77e8310c060f61caaff8a",
    "S15": "sha256:44136fa355b3678a1146ad16f7e8649e94fb4fc21fe77e8310c060f61caaff8a",
    "S16": "sha256:44136fa355b3678a1146ad16f7e8649e94fb4fc21fe77e8310c060f61caaff8a"
  },
  "publicOutput": {},
  "publicDigest": "sha256:44136fa355b3678a1146ad16f7e8649e94fb4fc21fe77e8310c060f61caaff8a",
  "validator": {
    "id": "nvidia:nvidia/nemotron-3-super-120b-a12b",
    "contractHash": "sha256:8619860b8a44d4e9f0bc4cac158b93bf559d2514f7e757e8387eb3bb69d810e6"
  },
  "tests": [
    {
      "id": "audit-schema",
      "status": "PASS",
      "artifactHash": "sha256:70c90dfa9085ecfb57a81e53b89ce972e3eaf45f4a462675e4e7d8437ad25d40"
    }
  ],
  "createdAt": "2026-08-22T14:01:28.292Z",
  "attestationHash": "sha256:01f2e0ca86082ae3af1369d28ecbefcc9e7706917ff15deb52c1f98aad2517dc"
}
