{
  "schemaVersion": "design-validation/attestation/v2",
  "targetId": "yyeongjin-secret-mcp-use--gdweb-26357",
  "sectionId": "S18",
  "fingerprint": "sha256:6fedeb2d3887a29361f2a847da09c3eb328394fe790a0af641a12f02282d7567",
  "triggerSource": {
    "path": "trigger/DESIGN_INDEX_gdweb-26357.md",
    "documentHash": "sha256:f79f163969cbb3520f2741dde3250533a4ff3071dcb772e53dd5802b918e6336",
    "fragmentHash": "sha256:080e7ac9556cc6527c0c54a8c31b885f501c9f99f5266e7bd9ad818fc892a7f6"
  },
  "specificationSource": {
    "path": "DESIGN_INDEX_SPECIFICATION.md",
    "documentHash": "sha256:65233a5428ae3411c094ab72691793e2998232e55ea5ca4e299993f7c4cf251a",
    "globalRulesHash": "sha256:397b59d360af5b81cb8816ecdf12ad45bbd3c55990df199c67adf9b399fb2987",
    "fragmentHash": "sha256:394ba411b0cb371db3c461c3d3c67efa6541f82883ddbebec15377e40657069a"
  },
  "status": "PASS",
  "baseCommit": "7689e42e9f5db897a627ea3c5e33f4327deba04f",
  "source": "fresh-audit",
  "requirementIds": [
    "S18-SECTION-080E7AC9556C"
  ],
  "dependencyAttestations": {
    "S05": "sha256:ea5fb2aea177929c442e13046725e3d26ce6eb97323a5b08de7de672a288cb17",
    "S06": "sha256:7d7f2d6039ff7ac6b5097c6e810cd586027b2b42dae57df7009730e9fbd8324a",
    "S09": "sha256:01a2b4468f5a8a55e9bcb94ecfedc218d87ddb2af932168e55e52c111d001612",
    "S10": "sha256:61210715a7a93a903c88f900805198be46011739e78472d470bf0580439a0063",
    "S11": "sha256:e2a9d650735b15ff3aa6b7619ea3cad7714b6e1af9c483a1655289481bd7c919",
    "S12": "sha256:422bd58f8b2dedad21a44618471df4474d3fa5ca7e68572fc5e03eefe69f702a",
    "S13": "sha256:46390fbd1c87570a4fb27f93364cd0babe7cf81f2fe6cb8124f791070bbc2529",
    "S14": "sha256:0214705b55bfdcce1550289367667ae42e75d3f1ed813956d378bfa8b76a6aa4"
  },
  "dependencyPublicDigests": {
    "S05": "sha256:44136fa355b3678a1146ad16f7e8649e94fb4fc21fe77e8310c060f61caaff8a",
    "S06": "sha256:44136fa355b3678a1146ad16f7e8649e94fb4fc21fe77e8310c060f61caaff8a",
    "S09": "sha256:44136fa355b3678a1146ad16f7e8649e94fb4fc21fe77e8310c060f61caaff8a",
    "S10": "sha256:44136fa355b3678a1146ad16f7e8649e94fb4fc21fe77e8310c060f61caaff8a",
    "S11": "sha256:44136fa355b3678a1146ad16f7e8649e94fb4fc21fe77e8310c060f61caaff8a",
    "S12": "sha256:44136fa355b3678a1146ad16f7e8649e94fb4fc21fe77e8310c060f61caaff8a",
    "S13": "sha256:44136fa355b3678a1146ad16f7e8649e94fb4fc21fe77e8310c060f61caaff8a",
    "S14": "sha256:44136fa355b3678a1146ad16f7e8649e94fb4fc21fe77e8310c060f61caaff8a"
  },
  "publicOutput": {},
  "publicDigest": "sha256:44136fa355b3678a1146ad16f7e8649e94fb4fc21fe77e8310c060f61caaff8a",
  "validator": {
    "id": "nvidia:nvidia/nemotron-3-super-120b-a12b",
    "contractHash": "sha256:8619860b8a44d4e9f0bc4cac158b93bf559d2514f7e757e8387eb3bb69d810e6"
  },
  "tests": [
    {
      "id": "audit-schema",
      "status": "PASS",
      "artifactHash": "sha256:4f06aebea37e1d1ddb1712b932279422c8352479450b3d7a59f07b03a9d028e3"
    }
  ],
  "createdAt": "2026-08-22T14:01:28.294Z",
  "attestationHash": "sha256:7472e628e57b68e46f2bce2d4b7ff6ea2fa1e5b6831429140b2005ee903a62f9"
}
