{
  "schemaVersion": "design-validation/attestation/v2",
  "targetId": "yyeongjin-secret-mcp-use--gdweb-26357",
  "sectionId": "S11",
  "fingerprint": "sha256:6af019767101622a97c96c888c18f3cd65da5c861ffdda7759c4ef4da6183919",
  "triggerSource": {
    "path": "trigger/DESIGN_INDEX_gdweb-26357.md",
    "documentHash": "sha256:f79f163969cbb3520f2741dde3250533a4ff3071dcb772e53dd5802b918e6336",
    "fragmentHash": "sha256:a5a6bb7befd5b0a2a5c4f896ea37115c56248e141a09b0e77d0a75f1eed6284c"
  },
  "specificationSource": {
    "path": "DESIGN_INDEX_SPECIFICATION.md",
    "documentHash": "sha256:65233a5428ae3411c094ab72691793e2998232e55ea5ca4e299993f7c4cf251a",
    "globalRulesHash": "sha256:397b59d360af5b81cb8816ecdf12ad45bbd3c55990df199c67adf9b399fb2987",
    "fragmentHash": "sha256:0714a5ce49d33ef82479f08378273c6cbdef478ad4003817d2795fedc0673fe1"
  },
  "status": "PASS",
  "baseCommit": "c530b09d636d534e6759f36ad1bb9f2692d2fc10",
  "source": "fresh-audit",
  "requirementIds": [
    "S11-REQ-119EA901744C",
    "S11-REQ-B53CC119039D",
    "S11-REQ-F1582EF0CB9B",
    "S11-REQ-EEFC841A575F",
    "S11-REQ-5066045276EA",
    "S11-REQ-36E99D16142D",
    "S11-REQ-8570CF8A9AA9",
    "S11-REQ-606FF5935702",
    "S11-REQ-41C00A46BE15",
    "S11-REQ-5A7585A9DA88",
    "S11-REQ-76CD95BC5EBF",
    "S11-REQ-665CF54170E9",
    "S11-REQ-A9E784F23665",
    "S11-REQ-8ADA84F8CCC9",
    "S11-REQ-0E671080B45B"
  ],
  "dependencyAttestations": {
    "S02": "sha256:20c6af8d67402f811ef426caf7647d110d6d400647cefe76c5313bae460a3c39",
    "S03": "sha256:eb073d181f74184e3c7d90c4ccc153e5332618135665f25370a932dbbac9a272"
  },
  "dependencyPublicDigests": {
    "S02": "sha256:44136fa355b3678a1146ad16f7e8649e94fb4fc21fe77e8310c060f61caaff8a",
    "S03": "sha256:44136fa355b3678a1146ad16f7e8649e94fb4fc21fe77e8310c060f61caaff8a"
  },
  "publicOutput": {},
  "publicDigest": "sha256:44136fa355b3678a1146ad16f7e8649e94fb4fc21fe77e8310c060f61caaff8a",
  "validator": {
    "id": "nvidia:nvidia/nemotron-3-super-120b-a12b",
    "contractHash": "sha256:77ef7bd557179e221a29bb84f5ecafaa8540d9efac38dffc3dd81d533b980071"
  },
  "tests": [
    {
      "id": "audit-schema",
      "status": "PASS",
      "artifactHash": "sha256:380c2b8e03c8bf70930935c46ce2523b46ffb221b873538350a18c50e030d093"
    }
  ],
  "createdAt": "2026-08-22T14:29:00.461Z",
  "attestationHash": "sha256:e090e090e740174c26c5f46cee5c3760c49a318bc7e60bd15a0165ce2317431b"
}
