{
  "schemaVersion": "design-validation/attestation/v2",
  "targetId": "yyeongjin-secret-mcp-use--gdweb-26357",
  "sectionId": "S03",
  "fingerprint": "sha256:6cd8c9a856aa19758b562e75741bef21ca516ec283d0d0cefe4868966a64050d",
  "triggerSource": {
    "path": "trigger/DESIGN_INDEX_gdweb-26357.md",
    "documentHash": "sha256:f79f163969cbb3520f2741dde3250533a4ff3071dcb772e53dd5802b918e6336",
    "fragmentHash": "sha256:4b6b1df256ecdb68282ddea2e640dd25f8ab9421e069f6e81d905c01a4e7c63f"
  },
  "specificationSource": {
    "path": "DESIGN_INDEX_SPECIFICATION.md",
    "documentHash": "sha256:65233a5428ae3411c094ab72691793e2998232e55ea5ca4e299993f7c4cf251a",
    "globalRulesHash": "sha256:397b59d360af5b81cb8816ecdf12ad45bbd3c55990df199c67adf9b399fb2987",
    "fragmentHash": "sha256:ab2d64cca87cedde7b0b4ec3f37dcb7c551533c8eed77e7620dc8915f47a8867"
  },
  "status": "PASS",
  "baseCommit": "c530b09d636d534e6759f36ad1bb9f2692d2fc10",
  "source": "fresh-audit",
  "requirementIds": [
    "S03-REQ-8E97A3537456",
    "S03-REQ-92A16BF546FB",
    "S03-REQ-83C46F4E1D08",
    "S03-REQ-51EC990297A6",
    "S03-REQ-99A97C6CB73E",
    "S03-REQ-EBA62230BE86",
    "S03-REQ-17A802FF800E"
  ],
  "dependencyAttestations": {
    "S01": "sha256:1790ba026a264f007ad488e2846128f97b18a46bd4992c5e3a5383005cc8b9ad",
    "S02": "sha256:20c6af8d67402f811ef426caf7647d110d6d400647cefe76c5313bae460a3c39"
  },
  "dependencyPublicDigests": {
    "S01": "sha256:44136fa355b3678a1146ad16f7e8649e94fb4fc21fe77e8310c060f61caaff8a",
    "S02": "sha256:44136fa355b3678a1146ad16f7e8649e94fb4fc21fe77e8310c060f61caaff8a"
  },
  "publicOutput": {},
  "publicDigest": "sha256:44136fa355b3678a1146ad16f7e8649e94fb4fc21fe77e8310c060f61caaff8a",
  "validator": {
    "id": "nvidia:nvidia/nemotron-3-super-120b-a12b",
    "contractHash": "sha256:77ef7bd557179e221a29bb84f5ecafaa8540d9efac38dffc3dd81d533b980071"
  },
  "tests": [
    {
      "id": "audit-schema",
      "status": "PASS",
      "artifactHash": "sha256:3209f2ac7aaf3a6305cbf01d647d2454913142f798ec0ed6a50a1758cab0ca4b"
    }
  ],
  "createdAt": "2026-08-22T14:29:00.459Z",
  "attestationHash": "sha256:eb073d181f74184e3c7d90c4ccc153e5332618135665f25370a932dbbac9a272"
}
